{
  "id": "sen-0001",
  "tenant_id": "t1",
  "role": "sensor",
  "label": "Branch office emulation sensor",
  "status": "revoked",
  "sandbox_allowed": false,
  "share_opt_in": null,
  "created_at": 1799999000000,
  "created_by": "tok-admin",
  "enrolled_at": 1800000000000,
  "cert_sha256": "fcaa13fdeea972bb2cb5e2cdfd3ef57503e43ea0b5c512ae0d528ee8c8d44c8c",
  "cert_expires_at": 1807776000000,
  "last_seen_at": 1800000300000,
  "last_ip": "203.0.113.50",
  "last_asn": 64511,
  "network_changed_at": 1800000600000,
  "revoked_at": 1800000900000,
  "revoke_reason": {
    "code": "operator_manual",
    "text": "Sensor host reported stolen; certificate revoked."
  }
}
