{
  "id": "host-0002",
  "tenant_id": "t1",
  "role": "host",
  "label": "Research VPS, Sydney",
  "status": "pending",
  "sandbox_allowed": true,
  "share_opt_in": null,
  "created_at": 1800000000000,
  "created_by": "tok-admin",
  "enrolled_at": null,
  "cert_sha256": null,
  "cert_expires_at": null,
  "last_seen_at": null,
  "last_ip": null,
  "last_asn": null,
  "network_changed_at": null,
  "revoked_at": null,
  "revoke_reason": null
}
